Body,Date,Feedbacks,HelpfulFeedbacks,MemberID,ProductID,Rating,RealName,ReviewID,ReviewOrder,Title_x,Verified,Label,Sales Rank,Brand,Sales Price,Title_y,0,1,2,3,4,5,6,7,8,9,10,11,12,13,14,15,16,17,18,19,20
"After setting booby traps for Zombies, I like to whip out my Bushnell Waterproof scope and wait for the oncoming herds to trample on in.  This scope is just great because it cuts down on glare and is also waterproof.  It is good to have some foreward advancement of options when dealing with the zombies so when you are set up this scope can give you good range in spotting them on your trail!!!",4/1/2007,24.0,4.0,A4X7FBQ5SKPI6,B0000A0AIS,5.0,0.0,655705.0,1.0,Best purchase when rounding out the survival kit,0.0,0,1906,Bushnell,299.99,Bushnell Trophy 20-60x65 Waterproof Spotting Scope (Green),EAN->0029757820655,Binding->Electronics,"Feature->Extra power for extra range, this is the ultimate portable",Brand->Bushnell,Feature->100% waterproof rubber armor construction for hunting and birding,ListPrice,Manufacturer->Bushnell,Model->78-2065,MPN->78-2065,PackageDimensions,ProductGroup->Photography,Publisher->Bushnell,SpecialFeatures->Waterproof,Studio->Bushnell,Title->Bushnell Trophy 20-60x65 Waterproof Spotting Scope (Green),UPC->029757820655,Feature->Premium multi-coated optics,Feature->Compact tripod,Feature->Includes both hard case and soft case,ItemDimensions,Label->Bushnell
"After spending $1,000 + on equipment for my Canon HG10, the last thing I want to do is drop it! I can be a bit of a klutz, so this wrist strap is great insurance for those times when I get pre-occupied and stop paying attention to my camera. Don't let a dropped camera ruin your day ... invest in this wrist strap!",7/28/2008,0.0,0.0,AJ88Z1U0SS1IY,B00009V4G9,5.0,1.0,657154.0,2.0,Perfect for my Canon HG10!,0.0,0,0,Canon,14.99,Canon WS20 Wrist Strap for all Canon Camcorders,EAN->0013803600315,Binding->Electronics,Feature->Extra security for your camcorder,Brand->Canon,Feature->Use with all Canon camcorders,MPN->3118A002,PackageDimensions,ProductGroup->Photography,Publisher->Canon,Studio->Canon,Title->Canon WS20 Wrist Strap for all Canon Camcorders,UPC->013803600315,,,,,ItemDimensions,Label->Canon,ListPrice,Manufacturer->Canon,Model->3118A002
"After searching from store to store for a perfect flat screen tv with all of the options, I finally found what I was looking for.  I expected either Sony or Toshiba to deliver the most superior and vibrant picture, but I was wrong.  Next to them was this JVC that far exceeded what I had expected for the price.  It's picture looks nearly as life-like as a screen with HDTV, and it is filled with many options that are usually only available on larger models.  It has many RCA cabel hook-ups, (S-Video, component, and color stream) which are all easily accessable.  It's front hook-up is conveniently concealed behind a cover panel, and all other menu options are also easily accessed behind this panel.  It's speakers sound great, and about the supposedly ""unbearable humming noise"" that exists on all JVC's and Toshiba's- I still haven't heard it on my set.  As an immaculate tv in picture and sound, I recommend it to all who search for that perfect tv!",8/4/2003,10.0,10.0,A7HGVO6SX2WSW,B00009RTCB,5.0,0.0,657959.0,1.0,Another Satisfied JVC Customer,0.0,0,127939,JVC,349.99,"JVC AV-24F704 24"" Flat-Screen TV (Silver)",DisplaySize->24,Binding->Electronics,EAN->0046838207327,Brand->JVC,Feature->24-inch Real Flat picture tube reduces ambient light reflections; TV is 26.375 x 20 x 19 inches (W x H x D),ListPrice,Manufacturer->JVC,Model->AV24F704,MPN->AV24F704,PackageDimensions,ProductGroup->CE,Publisher->JVC,Studio->JVC,"Title->JVC AV-24F704 24"" Flat-Screen TV (Silver)",UPC->046838207327,Warranty->1 year warranty,Feature->3-line digital comb filter eliminates dot crawl and cross-color interference,"Feature->Component- and S-video inputs enhance use with sources such as DVD, camcorders, game consoles, and satellite systems",Feature->Offers 5 watts per channel sound,Feature->Multifunction timer turns the TV on and off when you're not home or serves as an alarm clock or program reminder,Label->JVC
"After seeing the ads for the Digital Frame, My mother ordered it for my birthday.  It arrived today *August 1)in time, but right now - we are disappointed.  Unlike the clear, full color pics shown in the ads, the pictures on the Digital Frame are washed out, pale, grainy, and if YOU do not view from direct center, even turn ""negative"".  I am a  photographer - have done work for newspapers and magazines - and  the Digital Frame makes good photos look bad, and bad ones - well.....  Either the display is bad, or the product - but when viewd, a black or a dark color turns negative and when viewed from the side, it is a negative.    COlors are pale - not crisp and clean like on a current laptop, of flat panel monitor.  When viewed in daylight, you can hardly see the pictures. And at night - not much better.  I was hoping that i would get the clarity of a laptop, at the least, but laptops four years ago were clearer.  I will definately tell everyone that this product, as far as I am concerned, is misrepresented in its avertising. The quality is poor.  However, the casing is very nice, buttons easy to use, compact flash very accessable - too bad the quality of the picture did not match the rest of the design.  ...",8/2/2003,21.0,21.0,AR9BT8YFTPMZ1,B00009RAW5,1.0,0.0,658055.0,5.0,Misrepresented,0.0,0,9217,"Digital Frames, Inc.",299.99,"Digital Frames, Inc. 10"" Digital Picture Frame",EAN->0827583001008,Binding->Electronics,Feature->Easy to use!,"Brand->Digital Frames, Inc.","Feature->Large, 10 in LCD screen with 800 x 600 resolution for 8&#8221; x 10&#8221; photos.",PackageDimensions,ProductGroup->Photography,"Publisher->Digital Frames, Inc.","Studio->Digital Frames, Inc.","Title->Digital Frames, Inc. 10"" Digital Picture Frame",UPC->827583001008,,,,,,"Feature->No computer or internet connection required, and NO monthly fees.","Feature->Rotating stand for vertical or horizontal placement, or mount on the wall.","Label->Digital Frames, Inc.",ListPrice,"Manufacturer->Digital Frames, Inc."
"After seeing the bad reviews, I almost didn't purchase PDF Producer. However, I called Data Becker (during normal business hours at 617-614-0600) and, with very little trouble, got a live person on the phone who answered all of my questions and allayed my concerns.  Two good hints: It only works with Win 2000 or XP (as it says right on the specs); and, it's important to close ALL programs (including printer software) running in the backgroun before loading. PDF Producer loaded flawlessly in a few minutes on my Windows XP system with MS Office 2003. It works just like any other printer driver, and I personally like the idea that it doesn't intimately integrate with other programs (such as putting an icon on the task bars) -- if something does go wrong with PDF Producer my other programs are still in business. The product works excellently -- making PDF files of anything that can normally be printed. The PDF Producer settings needed a bit of tweaking to get the quality and file size I wanted, and this was easily done following the built-in help screens or the manual that came with the retail package. PDF Producer doesn't have all the functionality of Adobe Acrobat, but at about 1/6 the price it is a very cost-effective solution for turning just about anything into a basic PDF.",11/2/2003,13.0,13.0,A2NAAEOWL0G6VC,B00009L7N6,4.0,1.0,660656.0,18.0,PDF Producer is an excellent product.,0.0,0,4710,Data Becker,39.99,PDF Producer,EAN->0680466603054,Binding->CD-ROM,"Feature->With just a click, you can insert and embed active hyperlinks, bookmarks, fonts and watermarks",Brand->Data Becker,Feature->Optimize your important information for the Web or for print with the easy adjustment tools,PackageDimensions,Platform->Windows NT,Platform->Windows 2000,ProductGroup->Software,Publisher->Data Becker,Studio->Data Becker,Title->PDF Producer,UPC->680466603054,,,,Feature->Add encryption and password protection to keep your private documents confidential,"Feature->Fully supports multiple Microsoft office files -- turn your spreadsheets, Powerpoint files, Word documents and more into a PDF easily",Feature->Compatible with Adobe Acrobat and Adobe Acrobat Reader,Label->Data Becker,Manufacturer->Data Becker
"After searching for nearly a year for a security camera system for our home that we could view while travelling, I was thrilled to find out about Wilife. I read all the information on the Wilife website, and also what was available here on Amazon before purchasing.  Because our needs were specific, I made sure that they would be filled with this kit.  Here's what we needed: 1.  Remote camera that did not require hardwiring to connect to computer (computer is upstairs, camera position is downstairs). 2.  Camera triggered by motion, rather than always recording. 3.  Online access to the recorded video. After reading about the system, I realized I'd need to not only pay for the camera kit, but to get online access to recorded video (streaming video access is free) I'd also need to sign up for WiLife Platinum, at an additional $80 a year.  A steep price, but worth it if we'd be able to see any activity in the house by reviewing the recorded video online every evening. The system was very easy to set up, and worked acceptably well (the software did have a glitch when changing settings which I never did work out).  After signing up for platinum I was able to access recorded video online with my laptop computer, but my mobile device (HP iPaq 5915) would only access live video. I tried different operating systems (upgrading my Explorer Mobile, and switching to Opera Mobile), but still was only able to get live video to work. After re-reading the information on the WiLife site which stated: ""Go beyond live Internet viewing. Access your recorded video at anytime, anywhere.  Use easy search tools to locate and view video by date, time, and site - with up to the minute availability."" The site even showed a photo of a person accessing recorded video with a Blackberry, I assumed this must be an issue with my hardware, my software, or just 'operator error', so I continued to work through the problem. After a week of trying every possible solution, I contacted WiLife support, and after a few useless emails which did not address the problem, finally received one stating: ""Cellphones/handheld devices can not do remote playback. They can only do remote viewing in relay mode."" So, it is being packed up and shipped back to Amazon. I'm left wondering why Logitec would use a proprietary viewer for the recorded video, when the streaming video uses the regular Windows viewer available on all systems? And the biggest why - why would they advertise that remote playback was available 'anywhere anytime' when in fact it is NOT? In my opinion, this system is not worth anything to the average user until we can access recorded video via mobile device.  Once Logitec actually offering what they're advertising (anywhere, anytime), I'll happily purchase the product again.",6/30/2008,3.0,2.0,A3HRDRQ5VAFPQS,B000E0I9K4,1.0,1.0,666099.0,23.0,"Hardware is great, software severely lacking.",0.0,0,0,WiLife,299.99,WiLife L³kwerks Digital Video Surveillance Starter Kit - DVS-800i,"Color->Gray, Black",BatteriesIncluded->0,EAN->0853650001008,Brand->WiLife,Feature->Monitor and record up to six locations in real-time,Label->WiLife,ListPrice,Manufacturer->WiLife,Model->DVS-800i,MPN->DVS-800i,PackageDimensions,ProductGroup->CE,Publisher->WiLife,"SpecialFeatures->Processing Power: 400 MHzvDSP, Onboard Image Encoding: Windows« Media Video 9, Onboard Image Processing: Motion detection up to 16 zones; Auto brightness, Resolution Selectable: 320 X 240 or 640 X 480 pixels, Frame Rate & Bit Rate: Selectable, Color Depth: 10 bits",Studio->WiLife,SystemMemorySize->16,"Feature->View full-color video on PC, over Internet or on web-enabled cell phone or handheld device",Feature->Camera's power adapter also transmits images to PC over existing powerlines; no networking required,Feature->Werks software program included.,"Feature->Warranty: 90 days, limited",ItemDimensions
"After seeing that some folks had a problem with the itrip, I was a little hesitant. Also, I had one in the past that did not work well--lots of static (it was one of the ones that plugged directly into the bottom of your ipod, no cord). However, this one works well. I have used it in the urban area where I live for weeks with no problem and have also used it in more rural areas with good results. It's easy to use--the digital display is great. I got it on Amazon for about 1/3 of the price it was selling for at Target, so that was a great deal too.",1/18/2009,0.0,0.0,A26469S5741KMR,B000BWACX2,5.0,1.0,672568.0,385.0,great deal; works really well,0.0,0,0,Griffin Technologies,69.99,Griffin 9501-TRIPCB iTrip Auto FM Transmitter and Auto Charger for iPod,Brand->Griffin Technology,BatteriesIncluded->0,EAN->0685387092079,Binding->Electronics,"Feature->Combines a powerful FM transmitter with an integrated charger in order to recharge your iPod, while transmitting clear music through your car stereo",IsFragile->0,IsMemorabilia->0,ItemDimensions,Label->Griffin Technologies,"LegalDisclaimer->This Site operates AS-IS and AS-AVAILABLE, without liability of any kind. We are not responsible for events beyond our direct control. This Policy is governed by Florida law, excluding conflicts of law principles. Any legal actions against us must be commenced in Florida within one year after the claim arose, or be barred.",ListPrice,Manufacturer->Griffin Technologies,Model->9501-TRIPCBL,MPN->9501-TRIPCBL,PackageDimensions,ProductGroup->CE,"Feature->Compatible with every dock connector iPod, including the iPod Nano and 5th-generation iPods videos","Feature->Features selectable LX and DX modes for best-quality audio under real-world conditions, best-possible RF technology, and Griffin's world-class industrial design","Feature->Can operate anywhere from the 88.1 to 107.9 MHz frequencies, with a frequency response ranging from 50 Hz to 15 KHz, at a range from 10 to 30 feet","Feature->Weighs 0.6 ounces, measures 0.49 x 2.84 inches (W x D) with a total length of 33.47 inches including the cord, and comes backed by a manufacturer's limited 1-year warranty",IsAutographed->0
"After searching for a couple of months for something that could enable me to connect my sling box through wireless connection, I decided to buy the Buffalo. When it arrived I hooked it up and worked immediately.  I did not even have to install software!!!! The connection speed is great. Inexpensive versus ""wired"" bridges, EASY set-up and it works fantastic.",3/3/2007,0.0,0.0,A2DXUW56P5Y2RL,B000BNDEZY,5.0,1.0,675797.0,19.0,"If you are looking to make your Sling Box wireless, BUY IT!!!!!",0.0,0,1381,BUFFALO,79.99,Buffalo Technology AirStation Turbo G High Power Wireless Ethernet Converter ( WLI-TX4-G54HP ),Brand->BUFFALO,BatteriesIncluded->0,EAN->0747464109725,Binding->Electronics,Feature->Buffalo Technol WLI-TX4-G54HP TurboG HighPower Wireless Cv,ListPrice,Manufacturer->BUFFALO,Model->WLI-TX4-G54HP,MPN->WLI-TX4-G54HP,PackageDimensions,ProductGroup->CE,Publisher->BUFFALO,SpecialFeatures->nv:Device Type^Wireless Bridge|Interface^RJ-45|Form Factor^Desktop|Wireless Network Standards^IEEE 802.11g|Wireless Data Transfer Rates^125 Mbps|Wireless Network Configuration^Ad-Hoc (Peer-to-Peer)|Wireless Network Configuration^Infrastructure|Security Protocols^128-bit WEP|Security Protocols^64-bit WEP|Security Protocols^WPA-PSK|Modulation Technology^OFDM|Modulation Technology^DSSS|Networking Standards^IEEE 802.3 Ethernet 10Base-T|Networking Standards^IEEE 802.3u Ethernet 100Base-TX,Studio->BUFFALO,Title->Buffalo Technology AirStation Turbo G High Power Wireless Ethernet Converter ( WLI-TX4-G54HP ),UPC->747464109725,IsAutographed->0,IsMemorabilia->0,ItemDimensions,Label->BUFFALO,"LegalDisclaimer->This Site operates AS-IS and AS-AVAILABLE, without liability of any kind. We are not responsible for events beyond our direct control. This Policy is governed by Florida law, excluding conflicts of law principles. Any legal actions against us must be commenced in Florida within one year after the claim arose, or be barred."
after so many recalls from China we did not want our baby eating of plastic made over there. Although it has its downpoints it has one major good point _ made in Italy.,11/16/2007,0.0,0.0,A3V3YN2D855HIA,B000BN7Q3U,5.0,1.0,675909.0,5.0,best part - it is NOT MADE IN CHINA,0.0,0,2203,Peg Perego USA,159.99,Prima Pappa Diner,Brand->Peg Perego USA,BatteriesIncluded->0,Color->pink,Binding->Baby Product,EAN->0016337373717,ItemDimensions,Label->Peg Perego USA,ListPrice,Manufacturer->Peg Perego USA,Model->IMPDINUS40,MPN->IMPDINUS49PCU29,PackageDimensions,ProductGroup->Baby Product,Publisher->Peg Perego USA,Studio->Peg Perego USA,Title->Prima Pappa Diner,"Feature->Fully assembled, ready to use",Feature->Seat adjusts to seven height positions and has one-hand operation to recline seat in four positions,"Feature->Dual trays; large dinner tray for serving and eating is dishwasher safe, main play tray removes easily with one hand (with or without dinner tray attached)",Feature->Five-point safety harness and passive restraint system,"Feature->New large, mar-resistant castor wheels with brakes"
"After seeing many friends with this mat, we finally bought one.  We use it at our kitchen table instead of using it for travel.  Our son loves it, too.  It's easy to clean and doesn't stain!  We are giving it as a gift to all of our friends who have new babies.  We will be buying another one ourselves when our daughter is old enough to feed herself.",3/21/2005,1.0,1.0,A15D8R5208BSWP,B000BH79YW,5.0,1.0,678400.0,79.0,Love it!  Use it every day!,0.0,0,861,Kiddopotamus & Co,10.99,TinyDiner« Portable Placemat Pink Hey Diddle Diddle design,Brand->Kiddopotamus & Co,BatteriesIncluded->0,Color->Pink,Binding->Baby Product,EAN->0750849103171,Label->Kiddopotamus & Co,ListPrice,Manufacturer->Kiddopotamus & Co,Model->10317,PackageDimensions,ProductGroup->Baby Product,Publisher->Kiddopotamus & Co,ReleaseDate->2006-09-22,Studio->Kiddopotamus & Co,Title->TinyDiner« Portable Placemat Pink Hey Diddle Diddle design,UPC->750849103171,Feature->Raised edges contain mess at home and at restaurants,Feature->Suction cups on the bottom keep the placemat in place,Feature->Protects your child from table germs,Feature->Big mat rolls up into a tube,Feature->Made of plastic; for ages 6-30 mos.
"After seeing this product used by a associate, I decided to try it in our company.  We were looking for a more durable option for our employees to carry company cards.  The size is perfect for employees to put gas cards, business cards, VISA.  We further customized the product with labels and contact numbers.  The uses of the Bungee Card Case is limited by your imagination! Personally I load the cards that I will be using that day and slip it into my pocket. If I lose it, I only lost a few cards and not my entire life...  You can carry business cards (30+) and hunting licenses and tags!  We may even buy more to place in our vehicle glove box to hold license and registration papers making a fast easy find! Of the 20 we recently purchased not one has faulted!",10/11/2007,2.0,2.0,A3ITXQXCHLZVL9,B000BFR39A,5.0,1.0,678964.0,31.0,A great organizational tool!,0.0,0,2726,Umbra,5.99,Bungee Business Card Case / Wallet (Red/Aluminum),EAN->0028295107419,Binding->Office Product,"Feature->Umbra Bungee Gel business card case with elastic closure. A slim way to organize credit and business cards, money, keys and anything you can think of. Measures 4 1/2 x 2 3/4 x 1/2 inches.",Color->Translucent  Red,ItemDimensions,Publisher->Umbra,Studio->Umbra,Title->Bungee Business Card Case / Wallet (Red/Aluminum),UPC->028295107440,,,,,,,,Label->Umbra,ListPrice,Manufacturer->Umbra,Model->460330-647,ProductGroup->Office Product
"After seeing my friend's Modix HD-3510 hard drive based multimedia player, I wanted one too.  But, I wanted to do one better than my friend and get the Mvix MV-5000U (I think this model is the latest and supposedly most advanced of its kind) with the FM transmitter thinking I can use it in the car without the cassette adapter.  WRONG. Maybe I don't know how to use this unit properly because the sound quality is bad.  I hear hissing noise through the FM.  Same song plays well if I connect it directly to my sound system. The remote control is not very responsive.  I have to press the same button several times before it does anything. On the positive note, it plays most of my DivX, XviD files and all of my MP3 files.  Watching the video on the TV is a great experience.  Installing and configuring the hard drive was a snap.  I haven't tried the DVD ISO but hope it will play just as well. On the negative note, yes it is portable but its bigger than the Modix (about 50% thicker).  I feel the screen on the unit is useless.  After a week, the fan on the unit started to make noticeable sound. Because I had a chance to compare my Mvix with my friends Modix, I feel that I made a bad choice.  Mvix looked very slick on the internet but not in real life.  The company's support was sub par in my experience (their web support is non existent).  I am not a technically savvy person.  Long as it works without any problem and looks great doing it with good support when I need it, I am happy.  But that is not what I got. If you don't need the FM function, get something else.",11/15/2005,8.0,4.0,A2VVP5ND0G25W8,B000B9V3WO,2.0,0.0,680333.0,3.0,Not what I expected (I want my money back),0.0,0,7982,Mvix,249.0,MVIX (MV-5000U) Multimedia Player (w/ FM Transmiter),EAN->8809154177000,Brand->Mvix,Feature->Divx / AVI / MPEG1 / MPEG2 / MPEG 4 / Xvid / ISO / VOB / VCD (DAT) Video/Movie Player,Color->Grey / Silver,Feature->MP3 / AC3 / MP2 / OGG / WMA / DTS Audio Player / M3U Playlists,ListPrice,Manufacturer->Mvix,Model->MV-5000U,MPN->MV-5000U,ProductGroup->CE,Publisher->Mvix,"SpecialFeatures->LCD panel : 128 X 64   |   UP Scaling : 1920 X 1080i, 1280 X 720p",Studio->Mvix,Title->MVIX (MV-5000U) Multimedia Player (w/ FM Transmiter),,,"Feature->JPEG Slideshow Player, External HDD Portable Enclosure, FM Transmitter","Feature->S-video, Component Video, Optical Audio, USB 2.0, RCA 2-CH, Coaxial","Feature->Video Up-Scaling: 1920 X 1080i, 1280 X 720p, Compatibility: NTSC / PAL / AUTO",ItemDimensions,Label->Mvix
"After searching through reviews online, I decided to purchase the HB-207.  Users had lauded its comfort, ease of use, and versatility.  The bag is very sturdy, comfortably designed, and has the capability of holding a ton of equipment.  In fact, there are times when I have loaded down the bag to the point that it didn't meet airline carry-on weight expectations.  Nevertheless, because it is a backpack, I've never been asked to weigh it or check it at the airline counter. The bag is a bit large for casual use.  I would not recommended it as a day pack due to its bulky girth.  The bag is also not as convenient as a traditional shoulder bag when it comes to accessing your gear.  Despite its size, however, it still comfortably fits in an airline luggage compartment. The rear laptop compartment fits a bit snug.  If you are using a Mac or a small, slim computer, you should be fine. But if your computer measures greater than 15 1/2"" x 11"" x 2"", you'll be shoving and prodding just to get it to fit. In conclusion, the bag's pros consist of sturdy, well-crafted design, comfort, space, versatility, and, to a degree, inconspicuousness.  The cons might be it's lack of easy access on the field and its girth, rendering it useless for day trips.  But the bags pros far outweigh the cons.",7/2/2007,13.0,13.0,AD2Y80VE9HYR4,B000AOTTW6,4.0,1.0,684509.0,11.0,A well crafted bag that is near perfect,0.0,0,0,Kata,265.0,Kata GDC Series HB-207-T Hiker Backpack with InserTrolley for 2 - 3 SLR Bodies Plus Extras.,EAN->0719821251637,Binding->Electronics,ItemDimensions,Brand->Kata,Label->Kata,Studio->Kata,Title->Kata GDC Series HB-207-T Hiker Backpack with InserTrolley for 2 - 3 SLR Bodies Plus Extras.,,,,,,,,,,Manufacturer->Kata,Model->KTHB207,MPN->KTHB207T,ProductGroup->Photography,Publisher->Kata
